Case#,Submitted,From,Priority (H/M/L),Deadline,Target Completion,Status,Status As Of,Assigned To,Problem/Issue
939,01/07/2004,PSHERMAN,L,01/16/2004,,Assigned to,01/07/2004,Matthew,Automated Phone Directions need updated - north/south directions should be reversed
940,01/07/2004,TKEEFER,M,asap,,Assigned to,01/07/2004,Matthew,Color printer in Marketing is not working
941,01/07/2004,DDONOFRIO,H,01/12/2004,,Assigned to,01/07/2004,Matthew,"Harddrive on original pc crashed, need all information installed onto new pc"
942,01/07/2004,MARTYM,H,ASAP,,Assigned to,01/07/2004,Seth,Would like to have an abreviated report by Chilean Fruit Customer Sub-totals and Grand total of plts in house. (No piece of plts)
943,01/07/2004,RHORNE,H,,,Assigned to,01/07/2004,Matthew,Need to complete daily equipment/box status report
944,01/08/2004,KSKINNER,M,SOON,,Assigned to,01/08/2004,Matthew,I need Microsoft Project on my computer.
945,01/08/2004,LTREUT,H,ASAP,,TS Done-Awaiting OK,01/08/2004,Seth,Could not save in Withdraw.
946,01/08/2004,PKELLEY,H,ASAP,,Assigned to,01/08/2004,Matthew,Petfood scanner 213 not taking order number.
947,01/08/2004,MARTYM,H,ASAP,,Assigned to,01/08/2004,Matthew,Computer crashes before it finishes booting.
948,01/08/2004,RSMITH,H,ASAP,,Assigned to,01/08/2004,Matthew,Palm freezing up.
949,01/08/2004,DDONOFRIO,H,01/09/2004,,Assigned to,01/08/2004,Matthew,A scanner has been missing from my closet . I should have 8 scanners.
950,01/08/2004,DTHOMP,H,01/08/2004,,Assigned to,01/08/2004,Matthew,Scanner not working.
951,01/08/2004,MARTYM,M,ASAP,,Assigned to,01/08/2004,Seth,"CCDS's copier in the brick building will not feed multiple sheets, only copies one at a time manually."
952,01/08/2004,MARTYM,H,01/09/2004,,Assigned to,01/08/2004,Matthew,Please recover my files and update the shortcuts in my desktop
953,01/08/2004,MARTYM,M,01/12/2004,,Assigned to,01/08/2004,Matthew,Instlall Auto Save feature in my Excel
954,01/08/2004,RBETTS,H,01/08/2004,,TS Done-Awaiting OK,01/09/2004,Richard,Palm won't synch Scanned Employees
955,01/09/2004,MBILLIN,L,L,,Assigned to,01/09/2004,Matthew,FAX CCDS # 3400 NEEDS TONER..THANKS M
956,01/09/2004,ITHOMAS,M,,,Assigned to,01/09/2004,Matthew,Monitor Palm hot sync failure problem
957,01/09/2004,ITHOMAS,M,,,Assigned to,01/09/2004,Matthew,Looking for new solution for palm lcs
958,01/10/2004,RBETTS,H,01/10/2004,,Assigned to,01/10/2004,Seth,Palm frozed up.
959,01/10/2004,RBETTS,H,01/10/2004,,Assigned to,01/10/2004,Matthew,I can't log in to my computer
960,01/10/2004,MPHILLIPS,H,01/10/2004,,Assigned to,01/10/2004,Seth,Palm won't synch employees
961,01/10/2004,DDONOFRIO,H,01/10/2004,,Assigned to,01/10/2004,Matthew,Scanner 233 is having problems (bad pallet scanned)
962,01/10/2004,DDONOFRIO,H,01/10/2004,,Assigned to,01/10/2004,Matthew,Scanner 214 times out. (5 sec)
963,01/10/2004,DDONOFRIO,H,01/10/2004,,Assigned to,01/10/2004,Matthew,Scanner 233 No host response (Bad pallet scanned)
964,01/10/2004,DDONOFRIO,H,01/10/2004,,Assigned to,01/10/2004,Matthew,Scanner 226 No host Response (Bad pallet Scanned)
965,01/10/2004,DDONOFRIO,M,01/13/2004,,Assigned to,01/10/2004,Matthew,One of the batery chargers is not working
966,01/10/2004,DDONOFRIO,L,01/16/2004,,Assigned to,01/10/2004,Matthew,Light Bulb in Warehouse C is burnt. Please replace
967,01/10/2004,RCORBIN,H,01/11/2004,,Assigned to,01/10/2004,Seth,Time from Monday 5 doesn't show in Time Card
968,01/10/2004,MMARTY,M,01/10/2004,,Assigned to,01/10/2004,Matthew,Scanner has No host Response
